{
  "config_version": 1,
  "analysis_type": "binary",
  "data_file": "binary.csv",
  "output_dir": "../../results/fixtures/binary",
  "sample_id": "sample",
  "outcome": "response",
  "group_column": "patient",
  "clinical_columns": [
    "age",
    "sex"
  ],
  "outer_folds": 3,
  "inner_folds": 2,
  "max_features": 3,
  "panel_sizes": [
    1,
    3
  ],
  "bootstrap_samples": 0
}
